Season,Sector,Category,Crop,QueryType,QueryText,KccAns,StateName,DistrictName,BlockName,CreatedOn,cleanQueryText
KHARIF,HORTICULTURE,Vegetables,Bhindi(Okra/Ladysfinger),Cultural Practices,QUERY ABOUT CULTIVATION PRACTICES OF OKRA (BINDHI),"SUGGESTED:CULTIVATION PRACTICES OF BHINDI (OKRA)SPACING-45 X 30CM PLANT TO PLANT, SOWING TIME-JUNE-AUGUST,PRAPERATION OF LAND-PLOUGH THE LAND 45 TIMES, APPLY FYM @ 10KG PER HA, NEEM CAKE@1KG PER HA,SSP@ 100G PER HA. FURADON@ 10G PER SQ M. SEED TREATMENT WITH TRICHODERMA, HOT WATER TREATMENT WITH 51 DEGREE CELSIUS FOR 15 TO 20 MINUTES BEFORE CULTIVATION. SEED AVAILABLE AT ICAR, KVK, DEPARTMENT OF AGRICULTURE.",MEGHALAYA,EAST GARO HILLS,SAMANDA,2017-05-13 11:06:00.880,query cultivation practices okra bindhi
NA,AGRICULTURE,Others,Others,Credit,QUERY- KISAN CALL CENTER REGISTRATION,REGISTRATION IS HAS BEEN DONE IN KISAN CALL CENTER GUWAHATI REGISTRATION NUMBER IS 29662859,MEGHALAYA,EAST GARO HILLS,SAMANDA,2017-05-13 11:42:51.650,query kisan call center registration
KHARIF,HORTICULTURE,Vegetables,Bhindi(Okra/Ladysfinger),	Plant Protection	,Asking for garo agricultural pathologists expert.,Have transferred the call to the agricultural pathologists expert.,MEGHALAYA,EAST GARO HILLS,SAMANDA,2017-05-13 12:16:57.080,garo agricultural pathologists expert
NA,HORTICULTURE,Fruits,Banana,	Plant Protection	,ASKING ABOUT PLANT PROTECTION OF SIGATOKA IN BANANA,"SUGGESTED HIM TO GIVE MANCOZEB OR CYMOXANIL 30gm PER 15 LITRES OF WATER, OR VALIDOMYCINE 3% 50ML PER 15 LITRES OF WATER",MEGHALAYA,EAST GARO HILLS,RESUBELPARA,2017-05-17 12:52:04.597,plant protection sigatoka banana
NA,AGRICULTURE,Others,Others,Weather,QUERY ABOUT WEATHER REPORT FOR JAINTIA HILLS,"SUGGESTED: RAINFALL-12 MM, MAXIMUM TEMPERATURE-30 DEGREE CELCIUS, MINIMUM TEMPERATURE-23 DEGREE CELCIUS",MEGHALAYA,WEST GARO HILLS,BETASING,2017-05-01 06:45:11.397,query weather report jaintia hills
NA,AGRICULTURE,Green Manure,Dhaincha,Nutrient Management,QUERY ABOUT SOIL HEALTH CARD SCHEME,SUGGESTED: TO CONTACT NEAREST STATE AGRICULTURE DEPARTMENT,MEGHALAYA,WEST GARO HILLS,BETASING,2017-05-03 11:26:37.137,query soil health card scheme
JAYAD,HORTICULTURE,Vegetables,Others,Bio-Pesticides and Bio-Fertilizers,CALL FROM MEGHALAYA.,TRANSFER TO MEGHALAYA EXPERT.,MEGHALAYA,WEST GARO HILLS,BETASING,2017-05-05 10:53:19.103,call meghalaya
JAYAD,AGRICULTURE,Others,Others,Fertilizer Use and Availability,CALL FROM MEGHALAYA,TRANSFER TO MEGHALAYA,MEGHALAYA,WEST GARO HILLS,BETASING,2017-05-05 10:54:54.777,call meghalaya
NA,AGRICULTURE,Millets,FingerMillet  (Ragi/Mandika),Varieties,QUERY ABOUT SOIL HEALTH CARD FOR WEST GARO HILLS MEGHALAYA,"SUGGESTED: TO CONTACT STATE AGRICULTURE DEPARTMENT. SOIL HEALTH CARD SCHEME PROVIDE FERTILIZERS TO FARMER IN LOW PRICES, AND PROVIDE RS. 5000 PER HACTARE TO FARMERS.",MEGHALAYA,WEST GARO HILLS,BETASING,2017-05-05 11:05:51.473,query soil health card west garo hills meghalaya
NA,AGRICULTURE,Others,Others,Weather,query about weather report for west garo hills meghalaya,"suggested: rainfall-12mm, maximum temperature-32 degree celsius, minimum temperature-25 degree celsius",MEGHALAYA,WEST GARO HILLS,ZIKZAK,2017-05-26 10:55:36.500,query weather report west garo hills meghalaya
NA,AGRICULTURE,Others,Others,	Water Management	,query about weather report of west garo hills meghalaya,"suggested: rainfall-8mm, maximum temperature-32 degree Celsius, minimum temperature-27 degree celsius",MEGHALAYA,WEST GARO HILLS,BETASING,2017-05-28 10:59:06.137,query weather report west garo hills meghalaya
KHARIF,AGRICULTURE,Others,Others,Weather,Asking for weather report.,Have told him according to IMD data analysis.,MEGHALAYA,WEST GARO HILLS,ZIKZAK,2017-05-28 20:18:18.420,weather report
NA,HORTICULTURE,Fruits,Litchi,Cultural Practices,query about litchi seedling at west garo hills meghalaya,"suggested: to contact department of agriculture, kvk, icar tura",MEGHALAYA,WEST GARO HILLS,ZIKZAK,2017-05-31 06:43:10.777,query litchi seedling west garo hills meghalaya
,AGRICULTURE,Others,Others,Weather,CALL IS FROM OUTSIDE OF NORTH EAST,SUGGESTED TO CALL IN THIER STATE KISAN CALL CENTER,MEGHALAYA,RI BHOI,UMLING,2017-06-04 09:48:23.920,call north east
,HORTICULTURE,Vegetables,Tomato,Government Schemes,asking about  schemes in agriculture,I tried explaining to some extent but the line was disconnected.,MEGHALAYA,RI BHOI,UMLING,2017-06-10 20:58:30.103,schemes agriculture
,HORTICULTURE,Flowers,Anthurium,Government Schemes,asking about schemes in for floriculture,I explained to her in details about the various schemes available,MEGHALAYA,RI BHOI,UMLING,2017-06-10 21:10:50.647,schemes floriculture
,AGRICULTURE,Cereals,Paddy (Dhan),Cultural Practices,query about weather report of ri-boi district of meghalaya,"suggested:rainfall- 7mm, maximum temperature-28 degree celsius, minimum temperature-23 degree celsius",MEGHALAYA,RI BHOI,JIRANG,2017-06-22 15:30:36.297,query weather report riboi district meghalaya
KHARIF,HORTICULTURE,Vegetables,Tomato,Cultural Practices,cultural practice in tomato,answer explained in details,MEGHALAYA,EAST KHASI HILLS,MAWRYNGKNENG,2017-06-10 20:48:55.350,cultural practice tomato
NA,ANIMAL HUSBANDRY,Animal,"Bovine(Cow,Buffalo)",Cattle shed Planning and Management,SCHEMES FOR CONSTRUCTION OF SHED,ADVISED HIM TO CONSULT FROM VETERINARY DEPARTMENT,MEGHALAYA,EAST KHASI HILLS,MYLLIEM,2017-06-12 18:47:40.137,schemes construction shed
,AGRICULTURE,Cereals,Paddy (Dhan),Cultural Practices,QUERY ABOUT WEATHER REPORT FOR EAST KHASI HILLS,"SUGGESTED: RAINFALL-12MM, MAXIMUM TEMPERATURE-28 DEGREE CELSIUS, MINIMUM TEMPERATURE-21 DEGREE CELSIUS",MEGHALAYA,WEST KHASI HILLS,MAWKYRWAT,2017-06-02 10:46:34.860,query weather report east khasi hills
,AGRICULTURE,Cereals,Paddy (Dhan),Cultural Practices,call from meghalaya asked for khasi expert,suggested to call evening shift,MEGHALAYA,WEST KHASI HILLS,MAWKYRWAT,2017-06-14 12:37:28.150,call meghalaya khasi expert
,HORTICULTURE,Fruits,Almond,Cultural Practices,QUERY ABOUT WEATHER REPORT,"SUGGESTED: RAINFALL-8MM, MAXIMUM TEMPERATURE-28 DEGREE CELSIUS, MINIMUM TEMPERATURE-24 DEGREE CELSIUS",MEGHALAYA,WEST KHASI HILLS,MAWTHADRAISHAN,2017-06-24 16:18:26.350,query weather report
,FISHERIES,Inland,Others,Fish Fingerling Production,asking about scheme for constructing fishery pond,answered him in details,MEGHALAYA,EAST JAINTA HILLS,THADLASKEIN,2017-06-06 16:28:39.077,scheme constructing fishery pond
,AGRICULTURE,Others,Others,Cultural Practices,CALL FROM JAINTIA FARMER ASKED FOR JAINTIA EXPERT,CALL HAS BEEN TRANSFERRED TO JAINTIA EXPERT,MEGHALAYA,EAST JAINTA HILLS,THADLASKEIN,2017-06-08 15:13:00.463,call jaintia farmer expert
,AGRICULTURE,Others,Others,Cultural Practices,CALL FROM JAINTIA FARMER ASKED FOR JAINTIA EXPERT,CALL HAS BEEN TRANSFERRED TO JAINTIA EXPERT,MEGHALAYA,EAST JAINTA HILLS,THADLASKEIN,2017-06-08 16:11:34.793,call jaintia farmer expert
,HORTICULTURE,Vegetables,Tomato,Cultural Practices,TOMATO CULTURAL PRACTICES,EXPLAINED IN DETAILS,MEGHALAYA,EAST JAINTA HILLS,THADLASKEIN,2017-06-08 16:12:05.287,tomato cultural practices
,AGRICULTURE,Cereals,Paddy (Dhan),	Plant Protection	,RICE HISPA,Spray with Carbofuran 3% CG 50 kg/ha,MEGHALAYA,EAST JAINTA HILLS,THADLASKEIN,2017-06-08 19:18:12.697,rice hispa
,HORTICULTURE,Vegetables,"Colocasia (Arvi, Arbi)",Agriculture Mechanization,aphid infestation in colocassia,"Spray Quinalphos or Dimethoate 0.05%. Mealy bugs and scale insects damage cormels and corms and hence select cormels free of these pests for planting. If infested, the seed cormels should be dipped in Dimethoate 0.05% solution for 10 minutes.",MEGHALAYA,EAST JAINTA HILLS,LASKEIN,2017-06-12 18:21:58.680,aphid infestation colocassia
,FISHERIES,Inland,Fresh Water,Fishery Mechanization,asking scheme for for fishery mechanization,advised him to consult from the block or fishery department,MEGHALAYA,EAST JAINTA HILLS,THADLASKEIN,2017-06-14 18:20:34.057,scheme fishery mechanization
,HORTICULTURE,Fruits,Lemon,Cultural Practices,call from jaintia farmer asked for pnar expert,suggested to call day after tomorrow when pnar will be available,MEGHALAYA,EAST JAINTA HILLS,LASKEIN,2017-06-26 08:27:39.897,call jaintia farmer pnar expert
,AGRICULTURE,Cereals,Paddy (Dhan),	Field Preparation	,asked for khasi expert,suggested to call tomorrow since khasi expert not available,MEGHALAYA,EAST JAINTA HILLS,THADLASKEIN,2017-06-27 08:43:32.793,khasi expert
,AGRICULTURE,Cereals,Paddy (Dhan),Cultural Practices,call from jaintia hills,suggested to call  tomorow,MEGHALAYA,EAST JAINTA HILLS,THADLASKEIN,2017-06-29 15:28:29.640,call jaintia hills
,AGRICULTURE,Cereals,Paddy (Dhan),Organic Farming,QUERY ABOUT WEATHER REPORT,"SUGGESTED: RAINFALL-8MM, MAXIMUM TEMPERATURE-32 DEGREE CELSIUS, MINIMUM TEMPERATURE-24 DEGREE CELSIUS",MEGHALAYA,EAST GARO HILLS,DAMBO RONGJENG,2017-06-28 08:01:02.633,query weather report
KHARIF,AGRICULTURE,Others,Others,Weather,Asking for weather report.,Have told him according to the IMD data analysis.,MEGHALAYA,WEST GARO HILLS,SELSELLA,2017-06-04 17:40:12.920,weather report
NA,HORTICULTURE,Vegetables,Bhindi(Okra/Ladysfinger),	Plant Protection	,ASKING FOR PLANT PROTECTION MEASURES ON WHITEFLY OF OKRA,SUGGESTED HIM TO SPRAY ?Phosalone 35 EC @ 2.5 l/ha?Quinalphos 25 EC @ 2.0 l/ha?Triazophos 40 EC @ 2.0 l/ha,MEGHALAYA,WEST GARO HILLS,SELSELLA,2017-06-05 12:15:02.037,plant protection measures whitefly okra
NA,AGRICULTURE,Others,Others,Cultural Practices,query about weather report,"suggested: rainfall-8mm, maximum temperature-32 degree celcius, minimum temperature-27 degree celsius",MEGHALAYA,WEST GARO HILLS,BETASING,2017-06-07 07:19:43.163,query weather report
NA,HORTICULTURE,Plantation Crops,Arecanut,Fertilizer Use and Availability,ASKING ABOUT ARECANUT FERTILIZER DOSE AND SPACING,"SUGGESTED HIM TO MAKE A 90cm x 90 cm x 90 cm at a spacing of 2.75 m either way and covered with soil to the collar level and pressed around AND FOR MANURING Apply to each bearing palm (5 years and above) 10 - 15 kg of FYM or green leaf. 100:40:140 g of NPK/ tree/ year. To palms less than five years old, half of the above dose is recommended. Manures are applied during January - February after the North - East monsoon in a basin of 0.75-1.00 m radius around the tree to a depth of 20 - 30 cm.",MEGHALAYA,WEST GARO HILLS,BETASING,2017-06-26 10:59:29.420,arecanut fertilizer dose spacing
,AGRICULTURE,Cereals,Paddy (Dhan),Nutrient Management,CALLN FROM UNNOWN PERSON,IRRELEVENT CALL,MEGHALAYA,RI BHOI,UMLING,2017-07-05 11:52:15.407,calln unnown person
,HORTICULTURE,Vegetables,Cabbage,Cultural Practices,CULTIVATION PRACTICES OF TOMATO,EXPLAINED IN DETAILS,MEGHALAYA,RI BHOI,UMSNING,2017-07-24 11:56:07.313,cultivation practices tomato
,AGRICULTURE,Cereals,Oats ,Bio-Pesticides and Bio-Fertilizers,irrelavent call,suggested to cut the call,MEGHALAYA,EAST KHASI HILLS,KHADARSHNONG-LAITKROH,2017-07-10 12:56:21.570,irrelavent call
,AGRICULTURE,Cereals,Paddy (Dhan),Cultural Practices,CALL FROM KHASI HILL ASKED  FOR KHASI EXPERT,SUGGESTED TO CALL TOMOROW,MEGHALAYA,EAST KHASI HILLS,MYLLIEM,2017-07-18 13:08:57.420,call khasi hill expert
,HORTICULTURE,Vegetables,Amarphophallus (Surankand/Elephant Foot Yam),Bio-Pesticides and Bio-Fertilizers,call from khasi hills,suggested to call at 2pm,MEGHALAYA,EAST KHASI HILLS,KHADARSHNONG-LAITKROH,2017-07-20 08:03:53.353,call khasi hills
,AGRICULTURE,Pulses,Faba Bean (Horse Bean/windsor Bean),Agriculture Mechanization,CALL FROM UP,SUGGESTED TO CALL FROM UP SIM,MEGHALAYA,EAST KHASI HILLS,MAWRYNGKNENG,2017-07-23 13:49:17.000,call
,AGRICULTURE,Cereals,Paddy (Dhan),Agriculture Mechanization,CALL FROM NORTH EAST,CALL HAS BEEN DISCONNECTED DUE TO BAD SERVICE,MEGHALAYA,WEST KHASI HILLS,MAWKYRWAT,2017-07-19 10:47:21.693,call north east
,AGRICULTURE,Pulses,Faba Bean (Horse Bean/windsor Bean),Cultural Practices,call from khasi hills of meghalaya,suggested to call at saterday due to absence of khasi expert,MEGHALAYA,WEST KHASI HILLS,MAWKYRWAT,2017-07-20 15:28:18.863,call khasi hills meghalaya
,AGRICULTURE,Millets,Buck Wheat (Kaspat),Agriculture Mechanization,call from khasi farmer,suggested to call by saterday,MEGHALAYA,WEST KHASI HILLS,MAWKYRWAT,2017-07-20 15:30:12.427,call khasi farmer
,AGRICULTURE,Pulses,Faba Bean (Horse Bean/windsor Bean),Bio-Pesticides and Bio-Fertilizers,WEATHER REPORT,"SUGGESTED: RAINFALL 8MM, MAXIMUM TEMPERATURE-30 DEGREE CELCIUS, MINIMUM TEMP-25 DEGREE CELCIUS",MEGHALAYA,WEST KHASI HILLS,MAWSHYNRUT,2017-07-21 08:04:53.433,weather report
NA,AGRICULTURE,Others,Others,Cultural Practices,CALL FROMJAINTIA HILLS FARMER,SUGGESTED TO CALL BY SATERDAY SINCE PNAR EXPERT IS NOT AVAILABLE RIGHT NOW.,MEGHALAYA,EAST JAINTA HILLS,THADLASKEIN,2017-07-05 12:45:22.407,call fromjaintia hills farmer
NA,AGRICULTURE,Others,Others,	Plant Protection	,ASKING FOR KHASI EXPERT,REQUESTED HIM TO CALL ON SATURDAY AS KHASI EXPERT IS ON LEAVE,MEGHALAYA,EAST JAINTA HILLS,THADLASKEIN,2017-07-05 12:53:04.420,khasi expert
NA,AGRICULTURE,Cereals,Paddy (Dhan),	Water Management	,CALL FROM JAINTIA HILLS FARMER,SUGGESTED TO CALL BY SATERDAY,MEGHALAYA,EAST JAINTA HILLS,THADLASKEIN,2017-07-06 10:16:42.500,call jaintia hills farmer
NA,AGRICULTURE,Others,Others,	Plant Protection	,ASKING FOR KHASI EXPERT,CALL TRANSFERRED TO KHASI EXPERT,MEGHALAYA,EAST JAINTA HILLS,THADLASKEIN,2017-07-06 10:29:16.400,khasi expert
KHARIF,AGRICULTURE,Others,Others,Weather,Asking for weather report.,Have told him according to the IMD data analysis.,MEGHALAYA,EAST JAINTA HILLS,THADLASKEIN,2017-07-06 20:31:38.360,weather report
NA,AGRICULTURE,Cereals,Paddy (Dhan),Cultural Practices,call from jaintia hills,suggested to call by tomorow,MEGHALAYA,EAST JAINTA HILLS,LASKEIN,2017-07-07 11:42:01.697,call jaintia hills
NA,AGRICULTURE,Millets,Buck Wheat (Kaspat),	Water Management	,CALL FROM JAINTIA HILLS,SUGGESTED TO CALL AT 2PM,MEGHALAYA,EAST JAINTA HILLS,KHLIEHRIAT,2017-07-09 13:21:33.837,call jaintia hills
NA,HORTICULTURE,Flowers,China Astor,Cold Storage,CALL FROM JAINTIA FARMERS,SUGGESTED TO CALL BY SATERDAY,MEGHALAYA,EAST JAINTA HILLS,THADLASKEIN,2017-07-20 11:31:34.300,call jaintia farmers
NA,AGRICULTURE,Millets,Barnyard Millet (Kundiraivlli/Sawan,Agriculture Mechanization,CALL FROM KHASI HILLS,SUGGESTED TO CALL BY SATERDAY,MEGHALAYA,EAST JAINTA HILLS,THADLASKEIN,2017-07-21 11:40:40.227,call khasi hills
NA,AGRICULTURE,Others,Others,Training and Exposure Visits,ASKING ABOUT TRAINING PROGRAMME IN KVK AND ADDRESS,"Krishi Vigyan Kendra Jaintia Hills,Rymphum,Jowai-793150, Distt. West Jaintia Hills",MEGHALAYA,EAST JAINTA HILLS,KHLIEHRIAT,2017-07-26 12:57:15.513,training programme kvk address
KHARIF,AGRICULTURE,Others,Others,Weather,Asking for weather report.,Have told him according to the IMD data analysis,MEGHALAYA,EAST JAINTA HILLS,THADLASKEIN,2017-07-26 19:50:21.710,weather report
NA,AGRICULTURE,Cereals,Paddy (Dhan),Agriculture Mechanization,CALL FROM GARO HILLS MEGHALAYA,"SUGGESTED TO CALL AGAIN, DISCONECTED DUE TO NETWORK PROBLEM",MEGHALAYA,EAST GARO HILLS,DAMBO RONGJENG,2017-07-03 10:29:22.997,call garo hills meghalaya
KHARIF,AGRICULTURE,Others,Others,Weather,ASKING ABOU WEATHER REPORT,"The possibility of Rainfall is 112.0mm for the next five days.Maximum Temp: 29-30oC, Minimum Temp: 23-24oC, Cloudcover: sky will be cloudy i.e. 8 Okta, Maximum RH: 97-98%,Minimum RH: 73-87%, Wind speed: 5-6 Kmph, Wind direction:Northeast-Southeast.",MEGHALAYA,EAST GARO HILLS,DAMBO RONGJENG,2017-07-05 10:07:47.580,abou weather report
NA,ANIMAL HUSBANDRY,Animal,"Bovine(Cow,Buffalo)",Disease Management,QUERY REGARDING LOAN FROM NABARD,ASK TO INFORM IN NABARD ITSELF FOR INFORMATION,MEGHALAYA,EAST GARO HILLS,KHARKUTTA,2017-07-07 07:11:18.700,query loan nabard
NA,ANIMAL HUSBANDRY,Animal,"Bovine(Cow,Buffalo)",Dairy Production,QUERY REGARDING DAIRY PRODUCTION,SELECTION OF BREED HOUSING MEDICINE UTENSIL & APPLIANCES  COST OF FEED & BREED -- CONSIDERING ALL THIS MAKE A SCHEME AND  ONE SHOULD PROCEED FOR DAIRY FARMING,MEGHALAYA,EAST GARO HILLS,KHARKUTTA,2017-07-07 11:58:01.257,query dairy production
,AGRICULTURE,Others,Others,	Plant Protection	,ASKING FOR KHASI EXPERT,REQUESTED HIM TO WAIT FOR SOME FEW DAYS SINCE KHASI EXPERT IS NOT AVAILABLE,MEGHALAYA,RI BHOI,UMSNING,2017-08-06 11:20:04.063,khasi expert
,HORTICULTURE,Flowers,Chrysanthemum,Agriculture Mechanization,call from khasi hills,suggested,MEGHALAYA,RI BHOI,UMSNING,2017-08-11 11:46:44.410,call khasi hills
,HORTICULTURE,Flowers,Carnation,Field Preparation,CALL FROM MEGHALAYA,SUGGESTED,MEGHALAYA,RI BHOI,UMSNING,2017-08-27 15:13:22.917,call meghalaya
,AGRICULTURE,Millets,Buck Wheat (Kaspat),Agriculture Mechanization,CALL FROM KHASI HILLS,SUGGESTED,MEGHALAYA,RI BHOI,UMSNING,2017-08-29 09:36:28.800,call khasi hills
NA,HORTICULTURE,Condiments and Spices,Cinnamon,Crop Insurance,CALL FROM PUNJUB,SUGGESTED,MEGHALAYA,EAST KHASI HILLS,MAWRYNGKNENG,2017-08-07 12:13:26.207,call punjub
NA,AGRICULTURE,Millets,Common Millet (Panivaragu/Chena/Proso Millet/Hogm,Agriculture Mechanization,CALL FROM MEGHALAYA,SUGGESTED,MEGHALAYA,EAST KHASI HILLS,PYNURSLA,2017-08-13 08:52:47.290,call meghalaya
NA,AGRICULTURE,Others,Others,Credit,ASKING ABOUT KISAAN CREDIT CARD,REQUESESTED TO VISIT ANY NATIONALISED BANK NEAR BY THE VILLAGE,MEGHALAYA,EAST KHASI HILLS,MAWSYNRAM,2017-08-14 14:30:01.383,kisaan credit card
KHARIF,HORTICULTURE,Fruits,Citrus,	Plant Protection	,CALL FROM SHILLONG.,TRANSFER TO MEGHALAYA EXPERT,MEGHALAYA,EAST KHASI HILLS,MAWPHLANG,2017-08-17 15:16:40.527,call shillong
NA,AGRICULTURE,Pulses,Faba Bean (Horse Bean/windsor Bean),Bio-Pesticides and Bio-Fertilizers,call from khasi hills,suggested,MEGHALAYA,EAST KHASI HILLS,SHELLA BHOLAGANJ,2017-08-19 09:32:28.107,call khasi hills
NA,HORTICULTURE,Vegetables,Beans ,Crop Insurance,CALL FROM MP,SUGGESTED,MEGHALAYA,EAST KHASI HILLS,MAWPHLANG,2017-08-22 11:53:13.327,call mp
NA,AGRICULTURE,Others,Others,	Plant Protection	,ASKING FOR KHASI EXPERT,NOT AVAILABLE,MEGHALAYA,EAST KHASI HILLS,PYNURSLA,2017-08-22 16:50:09.300,khasi expert
NA,HORTICULTURE,Vegetables,ARUM ,Cold Storage,call from meghalaya,suggested,MEGHALAYA,EAST KHASI HILLS,MAWPHLANG,2017-08-24 10:28:38.207,call meghalaya
RABI,AGRICULTURE,Others,Others,Government Schemes,Asking for khasi expert of agriculture dept.,Have told him to call on 9862626105,MEGHALAYA,EAST KHASI HILLS,PYNURSLA,2017-08-27 13:37:31.647,khasi expert agriculture dept
NA,AGRICULTURE,Others,Others,	Plant Protection	,ASKING FOR KHASI EXPERT,INFORMED THAT KHASI EXPERT IS NOT AVAILABLE,MEGHALAYA,EAST KHASI HILLS,PYNURSLA,2017-08-30 07:26:40.227,khasi expert
NA,AGRICULTURE,Others,Others,	Plant Protection	,ASKING FOR KHASI EXPERT,NO KHASI EXPERT,MEGHALAYA,EAST KHASI HILLS,PYNURSLA,2017-08-30 13:31:20.873,khasi expert
NA,AGRICULTURE,Millets,Barnyard Millet (Kundiraivlli/Sawan,Bio-Pesticides and Bio-Fertilizers,query about weather report,"suggested: rainfall-9mm, maximum temperature-28 degree celcius, minimum temperature-22 degree celcius",MEGHALAYA,WEST KHASI HILLS,MAWKYRWAT,2017-08-09 08:31:58.950,query weather report
KHARIF,AGRICULTURE,Others,Others,Weather,Asking for weather report.,Have told him according to the IMD data analysis.,MEGHALAYA,WEST KHASI HILLS,MAWKYRWAT,2017-08-09 20:40:51.680,weather report
RABI,AGRICULTURE,Others,Others,Market Information,Asking for khasi expert.,Have given him the contact details.,MEGHALAYA,WEST KHASI HILLS,MAWKYRWAT,2017-08-29 18:46:21.597,khasi expert
NA,AGRICULTURE,Others,Others,Government Schemes,ASKING ABOUT GOVERNMENT SCHEMES,GIVEN HIM THE DETAILS,MEGHALAYA,EAST JAINTA HILLS,SAIPUNG,2017-08-03 11:57:53.077,government schemes
KHARIF,AGRICULTURE,Others,Others,Weather,Asking for weather report.,Have told him according to the IMD data analysis.,MEGHALAYA,EAST JAINTA HILLS,THADLASKEIN,2017-08-03 20:32:04.990,weather report
KHARIF,AGRICULTURE,Others,Others,Weather,Asking for weather report.,Have told him according to the IMD data analysis.,MEGHALAYA,EAST JAINTA HILLS,THADLASKEIN,2017-08-08 21:33:04.103,weather report
NA,HORTICULTURE,Vegetables,Tomato,	Plant Protection	,ASKING FOR TOMATO NUTRIENT MANAGEMENT,GIVEN HIM THE DETAILS,MEGHALAYA,EAST JAINTA HILLS,THADLASKEIN,2017-08-09 11:22:04.367,tomato nutrient management
NA,HORTICULTURE,Vegetables,Tomato,	Plant Protection	,query about wilting of tomato,"suggested: for tomato plant spray with borax (multiplex compony) at the rate of 2.5gm per liter water for fallinf of tomato, for control of termites you can can spray chloropyrephos in soil directly at evening times... before applying check the weather.. do not apply before heavy rain. remove all the infected leaves, twigs, parts of plants..",MEGHALAYA,EAST JAINTA HILLS,THADLASKEIN,2017-08-09 11:37:53.480,query wilting tomato
RABI,HORTICULTURE,Vegetables,Tomato,	Plant Protection	,Asking for control measures for aphid pest population in the tomato.,Have told him to spray Imidacloprid 30.5 SC @ 2ml/lit. of water which is to be sprayed 3 times after every week of spraying.,MEGHALAYA,EAST JAINTA HILLS,THADLASKEIN,2017-08-26 17:53:14.917,control measures aphid pest population tomato
NA,HORTICULTURE,Vegetables,Ash Gourd (Petha),Bio-Pesticides and Bio-Fertilizers,CALL FROM JAINTIA HILLS,SUGGESTED,MEGHALAYA,EAST JAINTA HILLS,THADLASKEIN,2017-08-28 09:41:26.187,call jaintia hills
KHARIF,AGRICULTURE,Others,Others,Government Schemes,CALL FROM MEGHALAYA.,TRANSFER TO MEGHALAYA EXPERT.,MEGHALAYA,EAST JAINTA HILLS,SAIPUNG,2017-08-28 17:29:19.797,call meghalaya
RABI,AGRICULTURE,Others,Others,Government Schemes,Asking for loan facilities for the farmers.,Have told him about kcc loan and to contact agricultural field officer in the nearest bank.,MEGHALAYA,EAST JAINTA HILLS,SAIPUNG,2017-08-28 17:29:26.200,loan facilities farmers
RABI,AGRICULTURE,Others,Others,Market Information,Asking for khasi expert.,Have given him the contact details for the khasi expert.,MEGHALAYA,EAST JAINTA HILLS,THADLASKEIN,2017-08-29 17:24:40.720,khasi expert
RABI,AGRICULTURE,Cereals,Paddy (Dhan),	Field Preparation	,ASKING ABOUT AGRI QUERY,TRANSFERRED,MEGHALAYA,EAST JAINTA HILLS,SAIPUNG,2017-08-30 15:07:08.193,agri query
RABI,AGRICULTURE,Others,Others,Government Schemes,Asking for agricultural loan facilities for farmers.,Have told him about kisan credit card and weather base insurance scheme.,MEGHALAYA,EAST JAINTA HILLS,SAIPUNG,2017-08-30 15:13:35.190,agricultural loan facilities farmers
,AGRICULTURE,Others,Others,	Plant Protection	,IRRELEVANT CALL,CALL DICONNECTED,MEGHALAYA,EAST GARO HILLS,KHARKUTTA,2017-08-21 13:27:28.103,irrelevant call
KHARIF,AGRICULTURE,Others,Others,Government Schemes,Asking for registration in kcc.,Have registered the farmers details.,MEGHALAYA,WEST GARO HILLS,BETASING,2017-08-03 16:44:34.517,registration kcc
NA,AGRICULTURE,Others,Others,	Plant Protection	,ASKING ABOUT WEATHER REPORT,GIVEN HIM ALL THE DETAILS,MEGHALAYA,WEST GARO HILLS,DADENGGRE,2017-08-04 15:21:07.983,weather report
NA,HORTICULTURE,Vegetables,ARUM ,Bio-Pesticides and Bio-Fertilizers,call from meghalaya,suggested,MEGHALAYA,WEST GARO HILLS,ZIKZAK,2017-08-13 10:12:29.023,call meghalaya
NA,FISHERIES,Inland,Cold Water,Deep Sea Fishing and Processing,ASKING FOR FISHERY EXPERT,REQUESTED TO CALL HIM AFTER 10 AM,MEGHALAYA,WEST GARO HILLS,BETASING,2017-08-17 07:50:23.357,fishery expert
RABI,AGRICULTURE,Others,Others,Government Schemes,Asking about kcc and how it helps the farmers.,Have told him about how kcc helps the farmers problem through phone conversation and other details.,MEGHALAYA,WEST GARO HILLS,DADENGGRE,2017-08-24 18:39:46.200,kcc helps farmers
,AGRICULTURE,Millets,Buck Wheat (Kaspat),Agriculture Mechanization,CALL FROM RI-BOI DISTRICT,SUGGESTED,MEGHALAYA,RI BHOI,UMSNING,2017-09-03 10:50:32.033,call riboi district
NA,FISHERIES,Marine,Other,Deep Sea Fishing and Processing,CALL FROM MP,SUGGESTED,MEGHALAYA,EAST KHASI HILLS,MAWPHLANG,2017-09-03 12:13:19.833,call mp
RABI,AGRICULTURE,Cereals,Paddy (Dhan),	Field Preparation	,ASKING ABOUT AGRI,TRANSFERRED,MEGHALAYA,EAST KHASI HILLS,MYLLIEM,2017-09-08 20:20:59.947,agri
NA,AGRICULTURE,Others,Others,	Plant Protection	,ASKING ABOUT KCC,EXPLAINED HIM IN DETAILS,MEGHALAYA,EAST KHASI HILLS,MAWSYNRAM,2017-09-15 08:57:11.663,kcc
NA,HORTICULTURE,Vegetables,Amarphophallus (Surankand/Elephant Foot Yam),Bio-Pesticides and Bio-Fertilizers,CALL FROM MEGHALAYA,SUGGESTED,MEGHALAYA,EAST KHASI HILLS,MAWKYNREW,2017-09-24 11:22:39.537,call meghalaya
NA,ANIMAL HUSBANDRY,Animal,"Bovine(Cow,Buffalo)",Integrated Farming,QUERY ABOUT THE REARING OF COWS AND BUFFALOES,SUGGESTED TO CONTACT STATE VETIRINARY DEPARTMENT,MEGHALAYA,WEST KHASI HILLS,MAWTHADRAISHAN,2017-09-07 09:52:41.277,query rearing cows buffaloes
RABI,AGRICULTURE,Others,Others,Weather,Asking for weather report.,Have told him according to the IMD data analysis.,MEGHALAYA,WEST KHASI HILLS,NONGSTOIN,2017-09-08 20:37:53.607,weather report
NA,AGRICULTURE,Millets,Common Millet (Panivaragu/Chena/Proso Millet/Hogm,Agriculture Mechanization,CALL FROM MEGHALAYA,SUGGESTED,MEGHALAYA,WEST KHASI HILLS,MAWSHYNRUT,2017-09-28 13:19:25.387,call meghalaya
NA,HORTICULTURE,Flowers,Chrysanthemum,Cold Storage,call from meghalaya,suggested,MEGHALAYA,EAST JAINTA HILLS,KHLIEHRIAT,2017-09-01 14:37:17.423,call meghalaya
KHARIF,AGRICULTURE,Cereals,Paddy (Dhan),Cultural Practices,CALL FROM MEGHALAYA.,TRANSFER TO MEGHALAYA .,MEGHALAYA,EAST JAINTA HILLS,SAIPUNG,2017-09-19 16:27:49.813,call meghalaya
KHARIF,AGRICULTURE,Cereals,Paddy (Dhan),Government Schemes,CALL FROM MEGHALAYA.,TRANSFER TO MEGHALAYA DESK,MEGHALAYA,EAST JAINTA HILLS,SAIPUNG,2017-09-19 16:29:17.730,call meghalaya
RABI,AGRICULTURE,Others,Others,Government Schemes,Asking about loan facilities for the farmers.,Have told him about Kisan credit card and its advantages.,MEGHALAYA,EAST JAINTA HILLS,SAIPUNG,2017-09-19 16:32:14.083,loan facilities farmers
