Season,Sector,Category,Crop,QueryType,QueryText,KccAns,StateName,DistrictName,BlockName,CreatedOn,cleanQueryText
RABI,AGRICULTURE,Others,Others,Government Schemes,About Kisan call centre.,"I told him that he avail information about Agriculture,Horticulture, Fishery and veterinary. I also told him that it remain open from 6 am to 10 pm everyday",MEGHALAYA,WEST GARO HILLS,ZIKZAK,2015-01-27 20:43:04.323,kisan call centre
RABI,AGRICULTURE,Others,Others,Crop Insurance,ASKED ABOUT CROP INSURANCE,TOLD ABOUT NATIONAL AGRICULTURE INSURANCE SCHEME (NAIS) ORRASHTRIYA KRISHI BIMA YOJANA (RKBY),MEGHALAYA,RI BHOI,UMSNING,2015-10-19 19:28:01.957,crop insurance
NA,AGRICULTURE,Others,Others,Weather,asking for weather report,Have told him According to IMD data analysis.,MEGHALAYA,RI BHOI,UMSNING,2015-10-19 20:24:09.683,weather report
RABI,ANIMAL HUSBANDRY,Animal,POULTRY  FARM ,Market Information,ASKED INFORMATION ON POULTRY MARKETING AND INSURANCE.,EPLAINED EVERYTHING IN DETAIL.,MEGHALAYA,RI BHOI,UMSNING,2015-10-19 20:39:06.913,information poultry marketing insurance
RABI,HORTICULTURE,Vegetables,Potato,	Plant Protection	,ASKED ABOUT PROTECTION OF POTATO FROM LATE BLIGHT.,USE OF MANCOZEB AT THE RATE OF 2 GRAM PER LITER WATER.,MEGHALAYA,EAST KHASI HILLS,MAWPHLANG,2015-10-12 15:28:03.560,protection potato late blight
RABI,AGRICULTURE,Others,Others,Weather,query regarding weather forecasting,moderate rainfall may occur during this week,MEGHALAYA,EAST KHASI HILLS,MAWPHLANG,2015-10-12 16:54:33.143,query weather forecasting
KHARIF,AGRICULTURE,Others,Others,	Plant Protection	,ASKED FOR REGISTRATION IN KCC,REGISTRATION HAS BEEN DONE,MEGHALAYA,EAST KHASI HILLS,MYLLIEM,2015-10-16 11:18:54.433,registration kcc
NA,HORTICULTURE,Fruits,Strawberry,Credit,QUERY  ABOUT KISAAN CREDIT CARD AND FIELD PREPARATION OF STRAWBERRY,EXPLAINED THE FARMER IN DETAILS ABOUT THE KISAAN CREDIT CARD AND FIELD PREPARATION OF STRAWBERRY,MEGHALAYA,EAST KHASI HILLS,KHADARSHNONG-LAITKROH,2015-10-20 10:10:53.457,query kisaan credit card field preparation strawberry
NA,AGRICULTURE,Others,Others,Government Schemes,Asking about self help group.,Have told him about the facilities and benefits on it.,MEGHALAYA,EAST KHASI HILLS,KHADARSHNONG-LAITKROH,2015-10-20 16:29:58.723,""
NA,AGRICULTURE,Others,Others,Government Schemes,ASKED ABOUT SELF HELP GROUP.,TOLD AS REQUIRED.,MEGHALAYA,EAST KHASI HILLS,KHADARSHNONG-LAITKROH,2015-10-20 16:50:44.790,""
RABI,HORTICULTURE,Fruits,Banana,Cultural Practices,ASKED ABOUT MANURING PRACTICES IN BANANA.,EXPLAINED EVERYTHING IN DETAIL.,MEGHALAYA,EAST KHASI HILLS,MYLLIEM,2015-10-21 20:03:36.857,manuring practices banana
NA,AGRICULTURE,Others,Others,Weather,Asking for weather report.,Have told him according to the IMD data analysis.,MEGHALAYA,EAST KHASI HILLS,MYLLIEM,2015-10-25 18:47:09.027,weather report
NA,HORTICULTURE,Vegetables,Potato,	Plant Protection	,Asking about fungicide which can be used in seed treatment of Potato.,Have told him to use bavistin @ 2gm/kg of Potato seed.,MEGHALAYA,EAST KHASI HILLS,MYLLIEM,2015-10-26 15:08:23.320,fungicide seed treatment potato
NA,AGRICULTURE,Others,Others,Weather,WEATHER REPORT,EXPLAINED IN DETAILS,MEGHALAYA,EAST KHASI HILLS,MYLLIEM,2015-10-31 09:44:08.897,weather report
RABI,HORTICULTURE,Vegetables,Cabbage,	Plant Protection	,Asked about control of aphids.,use of Chlorpyriphos/chlorpyrifos at the rate of 2 ml per liter of water and spray.,MEGHALAYA,WEST KHASI HILLS,NONGSTOIN,2015-10-21 15:49:25.213,control aphids
NA,HORTICULTURE,Vegetables,Cabbage,	Plant Protection	,ASKING FOR KHASI LANGUAGE,CALL TRANSFERRED TO KHASI EXPERT,MEGHALAYA,WEST KHASI HILLS,NONGSTOIN,2015-10-21 15:55:09.273,khasi language
RABI,AGRICULTURE,Others,Others,	Water Management	,Asked about irrigation in his field.,suggested to draw water from his nearby stream.,MEGHALAYA,EAST JAINTA HILLS,LASKEIN,2015-10-01 19:25:04.623,irrigation field
RABI,AGRICULTURE,Others,Others,	Water Management	,ASKED ABOUT WATER MANAGEMENT IN RABI SEASON.,SUGGESTED TO USE NEARBY STREAM WATER.,MEGHALAYA,EAST JAINTA HILLS,LASKEIN,2015-10-01 19:32:06.650,water management rabi season
NA,AGRICULTURE,Others,Others,Weather,Asking for weather report.,Have told him according to the IMD data analysis.,MEGHALAYA,EAST JAINTA HILLS,THADLASKEIN,2015-10-03 18:38:52.403,weather report
KHARIF,HORTICULTURE,Flowers,Gerbera,Cultural Practices,Query about flower cultivation.,detail practice has been explained,MEGHALAYA,EAST JAINTA HILLS,KHLIEHRIAT,2015-10-04 13:45:03.100,query flower cultivation
KHARIF,AGRICULTURE,Others,Others,Crop Insurance,Asked about crop insurance scheme.,Suggested Crop insurance schemes from Agriculture Insurance Company of India Limited.,MEGHALAYA,EAST JAINTA HILLS,THADLASKEIN,2015-10-07 11:25:47.577,crop insurance scheme
RABI,HORTICULTURE,Vegetables,Cabbage,Cultural Practices,QUERY ABOUT CULTURAL PRACTICES IN CABBAGE.,CULTURAL PRACTICES EXPLAINED IN DETAIL.,MEGHALAYA,EAST JAINTA HILLS,LASKEIN,2015-10-10 16:42:03.340,query cultural practices cabbage
RABI,HORTICULTURE,Vegetables,Pea (Vegetable),Cultural Practices,"Asked about cultural practices in pea, besides others.",all practices explained in detailed.,MEGHALAYA,EAST JAINTA HILLS,KHLIEHRIAT,2015-10-12 18:32:02.763,cultural practices pea
NA,AGRICULTURE,Others,Others,Weather,Asking for weather report.,Have told him according to the IMD data analysis.,MEGHALAYA,EAST JAINTA HILLS,LASKEIN,2015-10-14 19:30:41.853,weather report
NA,AGRICULTURE,Others,Others,Weather,Asking about weather condition.,Have told him according to the IMD data analysis.,MEGHALAYA,EAST JAINTA HILLS,LASKEIN,2015-10-15 15:41:31.773,weather condition
RABI,HORTICULTURE,Vegetables,Mushroom,Cultural Practices,ASKED ABOUT CULTURAL PRACTICES IN MUSHROOM.,EXPLAINED EVERYTHING IN DETAILS.,MEGHALAYA,EAST JAINTA HILLS,LASKEIN,2015-10-16 20:30:01.633,cultural practices mushroom
RABI,AGRICULTURE,Others,Others,Credit,Asked about credit.,told all kissan credit card.,MEGHALAYA,EAST JAINTA HILLS,THADLASKEIN,2015-10-19 19:18:31.027,credit
RABI,HORTICULTURE,Vegetables,Radish,Cultural Practices,"Asked about cultural practices in radish, carrot, mustard and plant protection in ginger.",explained everything in details.,MEGHALAYA,EAST JAINTA HILLS,LASKEIN,2015-10-20 19:10:01.190,cultural practices radish carrot mustard plant protection ginger
RABI,HORTICULTURE,Vegetables,Pea (Vegetable),Cultural Practices,ASKED ABOUT CULTURAL PRACTICES IN PEA (VEGETABLE).,EXPLAINED EVERYTHING IN DETAIL.,MEGHALAYA,EAST JAINTA HILLS,LASKEIN,2015-10-21 19:56:19.913,cultural practices pea vegetable
NA,AGRICULTURE,Others,Others,Weather,asked about weather report for jaintia hills,"answered in detailed: weather report for jaintia hills Rainfall-0mm, maximum temperature-30 degree celcius, minimum temperature-16 degree celcius",MEGHALAYA,EAST JAINTA HILLS,KHLIEHRIAT,2015-10-26 11:55:10.607,weather report jaintia hills
RABI,AGRICULTURE,Cereals,Paddy (Dhan),	Plant Protection	,Asked about control of gundhi bug.,Dust the crop with Carbaryl 5% or Malathion 5% dust or Chlorpyriphos 2% dust @ 20kg/ha in the morning hours with dusters. OR  Spray the crop with Monocrotophos or Endosulphan or Quinalphos @ 27ml/18litres water to reduce the population.,MEGHALAYA,EAST JAINTA HILLS,THADLASKEIN,2015-10-26 20:28:56.103,control gundhi bug
RABI,HORTICULTURE,Vegetables,Tomato,	Plant Protection	,"ASKED ABOUT PLANT PROTECTION IN TOMATO, RICE AND GINGER.",EXPLAINED EVERYTHING IN DETAILED.,MEGHALAYA,EAST JAINTA HILLS,THADLASKEIN,2015-10-29 19:20:28.693,plant protection tomato rice ginger
NA,HORTICULTURE,Fruits,Mango,	Plant Protection	,ASKED ABOUT CONTROL OF MANGO HOPPER.,"USE OF MEEM OIL, CHLORPYRIPHOS, FOR CONTROL.",MEGHALAYA,EAST JAINTA HILLS,THADLASKEIN,2015-10-29 19:52:32.990,control mango hopper
RABI,HORTICULTURE,Vegetables,"Colocasia (Arvi, Arbi)",	Plant Protection	,ASKED ABOUT CONTROL OF PEST INFESTATION OF CORM AND CORMELS OF COLACASIA,TREATMENT OF CORMELS WITH TURMERIC WATER OR DIMETHOATE 1 % SOLUTION PRIOR TO SOWING.,MEGHALAYA,EAST JAINTA HILLS,THADLASKEIN,2015-10-29 20:00:56.857,control pest infestation corm cormels colacasia
RABI,AGRICULTURE,Cereals,Paddy (Dhan),	Plant Protection	,"ASKED ABOUT CONTROL OF PEST INFESTATION IN RICE, DISEASE IN TOMATO.",EXPLAINED EVERYTHING IN DETAILS.,MEGHALAYA,EAST JAINTA HILLS,THADLASKEIN,2015-10-29 20:10:03.457,control pest infestation rice disease tomato
NA,AGRICULTURE,Others,Others,Weather,query about weather report for west garo hills meghalaya,"answered in detail: Rainfall- 0mm, maximum temperature-32 degree celcius, minimum temperature-22 degree celcius",MEGHALAYA,WEST GARO HILLS,ZIKZAK,2015-10-21 13:41:19.230,query weather report west garo hills meghalaya
NA,AGRICULTURE,Others,Others,Weather,ASKING ABOUT THE WEATHER REPORT IN WEST GARO HILLS DIST.,THERE IS NO PROBABILITY OF RAINFAL TODAY.,MEGHALAYA,WEST GARO HILLS,BETASING,2015-10-22 10:04:11.360,weather report west garo hills dist
RABI,HORTICULTURE,Vegetables,Cabbage,	Plant Protection	,ASKED ABOUT CROP PROTECTION IN CABBAGE.,"USE EITHER MALATHION OR CHLORPYRIPHOS AT THE RATE OF 2 ML IN 1 LITER WATER TO CONTROL THE INSECT. PLEASE PROTECT YOURSELF FROM THE SPRAY, COVER YOUR NOSE AND MOUTH WHILE SPRAYING. SPRAY IN EVENING TIME AND THEN TAKE BATH AND WASH YOUR CLOTHES IMMEDIATELY AFTER SPRAYING.",MEGHALAYA,WEST GARO HILLS,ZIKZAK,2015-10-23 21:40:37.557,crop protection cabbage
RABI,HORTICULTURE,Vegetables,Cabbage,	Plant Protection	,Asked about plant protection in cabbage and potato,USE CHLORPYRIPHOS/CHLORPYRIFOS OR MALATHOIN FOR INSECT INFESTATION IN CABBAGE. 2 ML IN 1 LITER WATER. USE TRICHODERMA FOR TREATMENT OF POTATO BEFORE SOWING.,MEGHALAYA,WEST GARO HILLS,ZIKZAK,2015-10-24 10:12:38.907,plant protection cabbage potato
NA,HORTICULTURE,Vegetables,Chillies,	Plant Protection	,control measure of disease in chillies,"CALL TRANSFERED TO AGRIL EXPERT, MEGHALAYA",MEGHALAYA,WEST GARO HILLS,ZIKZAK,2015-10-24 10:50:05.713,control measure disease chillies
KHARIF,HORTICULTURE,Vegetables,Cabbage,	Plant Protection	,ASKING ABOUT THE INSECT IN CABBAGE.,SUGGESTED TO SPRAY MALATHION 50 EC @2ML/LT OF WATER.,MEGHALAYA,WEST GARO HILLS,ZIKZAK,2015-10-24 11:26:30.300,insect cabbage
KHARIF,AGRICULTURE,Others,Others,Cultural Practices,QUERY ABOUT INFORMATION PROVIDED BY KCC,"ANSWERED IN DETAILED: KCC PROVIDE INFORMATION RELATED TO AGRICULTURAL, FISHERY, VETERINARY, BANK LOAN, GOVT. SCHEMME,MARKET PRICES OF FERTILIZERS, INSECTICIDES, PESTICIDES ETC",MEGHALAYA,SOUTH GARO HILLS,BAGHMARA,2015-10-20 10:07:19.373,query information provided kcc
NA,AGRICULTURE,Others,Others,Weather,ASKING FOR WEATHER FORCAST OF SOUTH GARO HILLS,EXPLAINED IN DETAILS ABOUT THE WEATHER FORCASTING,MEGHALAYA,SOUTH GARO HILLS,RONGARA,2015-10-21 13:19:42.263,weather forcast south garo hills
KHARIF,AGRICULTURE,Others,Others,Weather,asked about weather report for south garo hills meghalaya,"answered in detailed: weather report for south garo hills meghalaya, 29th to 31st oct rainfall-0mm, maximum temperature-31 degree celcius, minimum temperature-19 degree celcius. 1st nov date rainfall-0mm, maximum temperature-28 degree celcius, minimum temperature-18 degree celcius, date 2nd nov 2015- rainfall-0mm, maximum temperature-29 degree celcius, minimum temperature-19 degree celcius",MEGHALAYA,SOUTH GARO HILLS,RONGARA,2015-10-28 13:34:50.707,weather report south garo hills meghalaya
RABI,HORTICULTURE,Condiments and Spices,Ginger,Spices and Condiment Crops,soil enrichment in ginger fields.,explained soil enrichment and manuring practice in detailed.,MEGHALAYA,RI BHOI,UMSNING,2015-11-08 18:42:19.547,soil enrichment ginger fields
RABI,AGRICULTURE,Others,Others,Agriculture Mechanization,QUERY ABOUT AGRICULTURE FARM MACHINE SCHEME.,"SUGGESTED AGRICULTURE ENGINEERING (MECHANICAL) SCHEME OF DEPARTMENT OF AGRICULTURE, GOVERNMENT OF MEGHALAYA, STATE PLAN.",MEGHALAYA,RI BHOI,UMSNING,2015-11-13 13:48:20.467,query agriculture farm machine scheme
RABI,HORTICULTURE,Condiments and Spices,Ginger,Cultural Practices,QUERY ABOUT MANURING PRACTICES IN GINGER.,EXPLAINED EVERYTHING IN DETAILS.,MEGHALAYA,RI BHOI,UMSNING,2015-11-15 10:26:20.343,query manuring practices ginger
RABI,AGRICULTURE,Cereals,Paddy (Dhan),Weed Management,"QUERY ABOUT WEED MANAGEMENT, MANURING IN PASSY AND PE A VARIETIES.",EXPLAIED AND SUGGESTED  EVERYTHING IN DETAILS,MEGHALAYA,RI BHOI,UMSNING,2015-11-20 20:19:19.293,query weed management manuring passy pe varieties
NA,AGRICULTURE,Others,Others,Weather,Asking for weather report.,Have told him according to the IMD data analysis.,MEGHALAYA,RI BHOI,UMSNING,2015-11-27 18:06:00.427,weather report
RABI,HORTICULTURE,Vegetables,Mushroom,Cultural Practices,asked about cultivation practices in mushroom,explained everything in detail.,MEGHALAYA,EAST KHASI HILLS,MYLLIEM,2015-11-19 18:15:09.503,cultivation practices mushroom
RABI,HORTICULTURE,Vegetables,Mushroom,Cultural Practices,asked about mushroom cultivation.,explained everything in detail and suggested to undergo training for mushroom.,MEGHALAYA,EAST KHASI HILLS,MYLLIEM,2015-11-19 20:21:14.963,mushroom cultivation
RABI,HORTICULTURE,Vegetables,Mushroom,	Plant Protection	,ASKING ABOUT MUSHROOM CULTIVATION,ADVICED TO CONTACT WITH MUSHROOM ASOM GUWAHATI(9864221570),MEGHALAYA,EAST KHASI HILLS,MYLLIEM,2015-11-19 20:40:34.167,mushroom cultivation
RABI,HORTICULTURE,Vegetables,Tomato,Cultural Practices,QUERY ABOUT MANURING AND MANAGEMENT OF PHYSIOLOGICAL DISORDERS IN TOMATO.,EXPLAINED EVERYTHNG TO THE CALLER IN DETAIL.,MEGHALAYA,EAST KHASI HILLS,MAWRYNGKNENG,2015-11-28 20:03:26.020,query manuring management physiological disorders tomato
NA,AGRICULTURE,Others,Others,Weather,Asking for weather report.,Have told him according to the IMD data analysis.,MEGHALAYA,EAST KHASI HILLS,MAWRYNGKNENG,2015-11-28 21:04:05.210,weather report
NA,AGRICULTURE,Others,Others,	Field Preparation	,ASKING FOR KHASI EXPERT,ASKED HIM TO CALL AT 2 PM,MEGHALAYA,EAST JAINTA HILLS,THADLASKEIN,2015-11-06 08:26:24.397,khasi expert
RABI,AGRICULTURE,Others,Others,Crop Insurance,Asked about agricultural insurance.,NATIONAL AGRICULTURE INSURANCE SCHEME (NAIS) can be availed from reliable insurance company.,MEGHALAYA,EAST JAINTA HILLS,THADLASKEIN,2015-11-07 11:56:03.013,agricultural insurance
RABI,AGRICULTURE,Cereals,Paddy (Dhan),Cultural Practices,QUERY ABOUT SEED PRODUCTION POSSIBILITY IN HYBRID RICE.,IT IS NOT POSIBLE... EXPLAINED IN DETAILED.,MEGHALAYA,EAST JAINTA HILLS,KHLIEHRIAT,2015-11-11 14:31:44.920,query seed production possibility hybrid rice
NA,AGRICULTURE,Others,Others,Weather,Asking for weather report.,Have told him according to the IMD data analysis.,MEGHALAYA,EAST JAINTA HILLS,THADLASKEIN,2015-11-16 19:04:24.527,weather report
RABI,AGRICULTURE,Others,Others,Crop Insurance,QUERY ABOUT CROP INSURANCE SCHEME.,SUGGESTED NATIONAL AGRICULTURE INSURANCE SCHEME.,MEGHALAYA,EAST JAINTA HILLS,LASKEIN,2015-11-17 19:23:24.503,query crop insurance scheme
RABI,AGRICULTURE,Others,Others,Crop Insurance,Asked about crop insurance.,"Suggested "" National Agriculture Insurance Scheme"" and ""Agriculture Insurance Company of India Limited""",MEGHALAYA,EAST JAINTA HILLS,LASKEIN,2015-11-18 17:43:32.230,crop insurance
RABI,AGRICULTURE,Others,Others,Government Schemes,asked about financial help and scheme.,suggested Agriculture engineering (mechanical) scheme for purchase of power tiller and kisan credit card for agriculture loans.,MEGHALAYA,EAST JAINTA HILLS,LASKEIN,2015-11-18 17:55:34.700,financial scheme
RABI,AGRICULTURE,Others,Others,Weather,ASKING WEATHER FORECAST INFORMATION,PARTLY CLOUDY SKY WITH NO RAINFALL FROM 24/11/15 TO 29/11/15,MEGHALAYA,EAST JAINTA HILLS,KHLIEHRIAT,2015-11-24 19:29:03.960,weather forecast information
RABI,ANIMAL HUSBANDRY,Animal,POULTRY  FARM ,"Animal Production (Piggery, Goatery, Sheep Farming etc.)",QUERY ABOUT POULTRY INCUBATOR COST.,TOLD IN DETAILS ALONG WITH SCHEME.,MEGHALAYA,EAST JAINTA HILLS,KHLIEHRIAT,2015-11-25 13:32:29.277,query poultry incubator cost
RABI,AGRICULTURE,Others,Others,Credit,QUERY ABOUT CREDIT AND INSURANCE.,SUGGESTED KISAN CREDIT CARD AND NATIONAL AGRICULTURE INSURANCE SCHEME.,MEGHALAYA,EAST JAINTA HILLS,LASKEIN,2015-11-29 15:29:13.797,query credit insurance
NA,AGRICULTURE,Others,Others,	Field Preparation	,ASKING FOR KHASI EXPERT,CALL TRANSFERED,MEGHALAYA,EAST JAINTA HILLS,THADLASKEIN,2015-11-30 14:01:38.487,khasi expert
RABI,HORTICULTURE,Fruits,Citrus,	Plant Protection	,asked about plant protection (insect)in citrus.,APPLICATION OF MALATHION OR CHLORPYRIPHOS 2ML PER LITER OF WATER,MEGHALAYA,EAST JAINTA HILLS,THADLASKEIN,2015-11-30 14:17:06.120,plant protection insectin citrus
RABI,HORTICULTURE,Fruits,Citrus,Government Schemes,QUERY ABOUT SCHEME FOR FRUIT ORCHARD.,SUGGESTED FRUIT DEVELOPMENT SCHEME OF STATE PLAN OF GOVERNMENT OF MEGHALAYA.,MEGHALAYA,EAST JAINTA HILLS,THADLASKEIN,2015-11-30 14:22:35.123,query scheme fruit orchard
RABI,HORTICULTURE,Vegetables,Cabbage,Cultural Practices,QUERY ABOUT SOWING TIME IN CABBAGE/CAULIFLOWER.,SUGGESTED APRIL/MAY AS SOWING TIME AND TRANSPLANT AFTER A MONTH AS IT IS IN THE HILLY AREAS.,MEGHALAYA,EAST JAINTA HILLS,THADLASKEIN,2015-11-30 19:09:29.613,query sowing time cabbagecauliflower
,AGRICULTURE,Others,Others,Weather,weather report,"clouds and sun on sky till 17 nov'15, according to  accuweather",MEGHALAYA,EAST GARO HILLS,KHARKUTTA,2015-11-13 16:17:03.090,weather report
,AGRICULTURE,Others,Others,Government Schemes,ASKING FOR GARO LANGUAGE EXPERT,TRANSFERING YOUR CALL TO GARO EXPERT PLEASE CONSULT WITH HER,MEGHALAYA,EAST GARO HILLS,KHARKUTTA,2015-11-14 10:01:25.670,garo language expert
,AGRICULTURE,Cereals,Paddy (Dhan),	Field Preparation	,ASKING FOR WEATHER REPORT,EPLAINED IN DETAILS,MEGHALAYA,EAST GARO HILLS,KHARKUTTA,2015-11-14 10:06:16.510,weather report
,AGRICULTURE,Cereals,Paddy (Dhan),	Plant Protection	,ASKING FOR CROP PROTECTION ON INFESTATION BY RICE EARHEAD BUG,ASK HIM TO Malathion 50 EC 500 ml/ha Neem seed kernel extract 5% 25 kg/ha,MEGHALAYA,WEST GARO HILLS,ZIKZAK,2015-11-05 10:59:23.180,crop protection infestation rice earhead bug
,HORTICULTURE,Vegetables,Cauliflower,	Plant Protection	,ASKING FOR ORGANIC PLANT PROTECTION ON CABBAGE BUTTERFLY INFESTATION,EXPLAINED IN DETAILS,MEGHALAYA,WEST GARO HILLS,ZIKZAK,2015-11-05 11:14:14.587,organic plant protection cabbage butterfly infestation
,AGRICULTURE,Others,Others,Weather,CALL FROM MEGHALAYA,TRANSFER TO MEGHALAYA EXPERT - 3812,MEGHALAYA,WEST GARO HILLS,ZIKZAK,2015-11-12 14:26:56.397,call meghalaya
,AGRICULTURE,Others,Others,	Field Preparation	,WEATHER REPORT,EXPLAINED IN DETAILS,MEGHALAYA,WEST GARO HILLS,ZIKZAK,2015-11-14 11:54:38.393,weather report
,AGRICULTURE,Others,Others,Weather,ASKED ABOUT WEATHER REPORT FOR WEST GARO HILLS DISTRICT OF MEGHALAYA,"ANSWERED IN DETAIL: 20TH-24TH NOV 2015 Rainfall- 0mm, Maximum temperature for-20th, 21st, 22nd and 24th nov 2015 - 27 degree celcius, Maximum temperature for 23rd nov-26 degree celcius, Minimum temperature for 20th and 21st nov-16 degree celcius, 22nd to 24th nov-15 degree celcius",MEGHALAYA,WEST GARO HILLS,ZIKZAK,2015-11-19 13:13:36.620,weather report west garo hills district meghalaya
,HORTICULTURE,Vegetables,Leafy Vegetable,	Plant Protection	,ASKED ABOUT WHITE RUST OF MUSTARD CAUSED BY ALBUGO CANDIDA,"ANSWERED IN DETAIL: SPRAY COPPER OXYCHLORIDE @ 1g IN ONE LITER OF WATER, REMOVE INFECTED PARTS OF PLANT FROM THE FIELD TO AVOID SPREAD OF INFECTION,ALWAYS PRACTICE HOT WATER TREATMENT AT 51 DEGREE CELCIUS FOR 15 TO 20 MINUTES BEFORE SOWING",MEGHALAYA,WEST GARO HILLS,ZIKZAK,2015-11-26 10:03:25.610,white rust mustard caused albugo candida
,AGRICULTURE,Others,Others,Weather,Asking about weather report.,Have told him according to the IMD data analysis.,MEGHALAYA,SOUTH GARO HILLS,RONGARA,2015-11-20 16:22:11.670,weather report
NA,AGRICULTURE,Others,Others,Organic Farming,Asking about can electricity house near by farm would hamper the growth and development of farm.,Have told him that the electricity house nearby farm is not harmful for crops.,MEGHALAYA,EAST KHASI HILLS,MAWPHLANG,2015-12-21 21:26:21.437,electricity house farm hamper growth development
NA,AGRICULTURE,Others,Others,Post Harvest Preservation,Asking about preservation process of cow milk.,"Have told him to heat the milk at constant temperature and after cooling rinse it under running water to remove the smell of the lemon juice. If using yogurt you can skip rinsing. Make a knot to the cheese cloth, squeeze any excess water and hang it for 30 mins to remove excess whey. Place muslin cloth on a plate with wholes, place a heavy object on it for the paneer to set.",MEGHALAYA,EAST KHASI HILLS,MAWPHLANG,2015-12-23 14:05:14.973,preservation process cow milk
RABI,FISHERIES,Inland,Fresh Water,"Tank, Pond and Reservoir Management",QUERY REGARDING LIMING IN POND,ADVICE HIM TO APPLY LIME @ 5KG/BIGHAS OF WATER SPREAD AREA,MEGHALAYA,EAST KHASI HILLS,MAWKYNREW,2015-12-26 20:45:27.800,query liming pond
NA,AGRICULTURE,Others,Others,Weather,Asking for weather report.,Have told him according to the IMD data analysis.,MEGHALAYA,EAST JAINTA HILLS,THADLASKEIN,2015-12-02 14:36:22.360,weather report
NA,AGRICULTURE,Others,Others,Weather,ASKING FOR WEATHER REPORT,EXPLAINED IN DETAILS,MEGHALAYA,EAST JAINTA HILLS,THADLASKEIN,2015-12-05 10:17:17.777,weather report
NA,AGRICULTURE,Others,Others,	Plant Protection	,ASKING FOR KHASI EXPERT,ASKED HIM TO CALLED AFTER THE RECRUITMENT OF NEW KHASI EXPERT,MEGHALAYA,EAST JAINTA HILLS,KHLIEHRIAT,2015-12-09 10:16:02.837,khasi expert
RABI,AGRICULTURE,Others,Others,Weather,querry regarding rainfall prediction in jaintia hills,rainfall (mm) will be 0mm in the coming 5 days from 11 to 15 of december,MEGHALAYA,EAST JAINTA HILLS,KHLIEHRIAT,2015-12-10 21:52:46.703,querry rainfall prediction jaintia hills
RABI,AGRICULTURE,Others,Others,Weather,ASKING ABOUT WEATHER FORECAST,Sky was mainly clear with no rainfall. Maximum temperatures ranged between 18°C and minimum ranged between 7-8°C. The expectedrelative humidity will be 76-90% (maximum) & 31-43% (minimum). Wind direction will be North East at a speed of 4 kmph during thenext five day,MEGHALAYA,EAST JAINTA HILLS,LASKEIN,2015-12-19 13:17:49.490,weather forecast
NA,HORTICULTURE,Condiments and Spices,Ginger,	Plant Protection	,Query for control measures for shoot borer pest population in Ginger.,Have told him to use Achook (organic) @ 4ml/lit. of water or Malathion (Chemical) @ 2ml/lit. of water 3 times after every week of spraying,MEGHALAYA,EAST JAINTA HILLS,LASKEIN,2015-12-19 17:10:06.850,query control measures shoot borer pest population ginger
,AGRICULTURE,Others,Others,Government Schemes,Asking about kisan credit card.,Advice him about the facilities of kisan credit card and have told him to visit National Bank for Agricultural and Rural Development or Reserve Bank of India to avail the facility.,MEGHALAYA,EAST GARO HILLS,KHARKUTTA,2015-12-21 19:14:00.683,kisan credit card
NA,AGRICULTURE,Others,Others,Weather,WEATHER REPORT,EXPLAINED IN DETAILS,MEGHALAYA,WEST GARO HILLS,ZIKZAK,2015-12-04 12:06:04.697,weather report
NA,HORTICULTURE,Vegetables,Leafy Vegetable,	Plant Protection	,ASKING FOR PREVENTION AND CONTROL OF FMD OF CATTLE AND ALSO THE PEST MANAGEMENT OF GREEN LEAFY VEGETABLES,ADVICED HIM TO VISIT THE DOCTOR IN CASE OF FMD PREVENTION IN CATTLE AND ASKED HIM TO APPLY CHLOROPYRIFOS FOR INSECT AND BAVISTIN FOR WHITE RUST,MEGHALAYA,WEST GARO HILLS,ZIKZAK,2015-12-09 10:46:02.673,prevention control fmd cattle pest management green leafy vegetables
NA,AGRICULTURE,Others,Others,Government Schemes,Asking about USSD facilities for farmers.,"Have told him about various sms facilities in USSD scheme like sms regarding dealers for seeds, fertilizer, farm machinery etc.",MEGHALAYA,WEST GARO HILLS,ZIKZAK,2015-12-19 14:30:52.680,ussd facilities farmers
RABI,HORTICULTURE,Vegetables,Leafy Vegetable,Cultural Practices,CALL FROM MEGHALAYA.,"GARO EXPERT IS NOT AVAILABLE TODAY,PLEASE CALL TOMORROW AFTER 10 AM.",MEGHALAYA,WEST GARO HILLS,DALU,2015-12-26 11:27:26.147,call meghalaya
NA,HORTICULTURE,Vegetables,Broccoli,	Plant Protection	,CONTROL MEASURE OF DISEASE IN BROCOLI,"CALL TRANSFERED TO AGRIL. EXPERT, MEGHALAYA",MEGHALAYA,WEST GARO HILLS,ZIKZAK,2015-12-31 12:59:22.390,control measure disease brocoli
,AGRICULTURE,Others,Others,Weather,QUERY ABOUT WEATHER REPORT,EXPLAIN IN DETAILS WITH REFERENCE TO AMD,MEGHALAYA,RI BHOI,UMLING,2015-02-11 17:24:10.677,query weather report
,HORTICULTURE,Vegetables,Tomato,	Plant Protection	,TOMOTA NURSERY RAISING,EXPLAINED IN DETAILS ABOUT NURSERY BED AND SEED TREATMENT,MEGHALAYA,RI BHOI,UMSNING,2015-02-19 17:19:05.627,tomota nursery raising
,HORTICULTURE,Fruits,Citrus,Cultural Practices,citrus cultural practices,answered in details..,MEGHALAYA,EAST KHASI HILLS,MAWRYNGKNENG,2015-02-05 12:34:12.040,citrus cultural practices
,HORTICULTURE,Vegetables,Carrot,	Plant Protection	,query about carrot plantation,call transfer to expert,MEGHALAYA,EAST JAINTA HILLS,THADLASKEIN,2015-02-05 17:15:28.457,query carrot plantation
,HORTICULTURE,Condiments and Spices,Ginger,	Plant Protection	,GINGER SEED TREATMENT,Treat the seed rhizomes with Mancozeb or Copper oxychloride 3 g/lit,MEGHALAYA,EAST JAINTA HILLS,THADLASKEIN,2015-02-07 11:53:53.497,ginger seed treatment
,AGRICULTURE,Cereals,Paddy (Dhan),Cultural Practices,rice cultural practice,answered in details,MEGHALAYA,EAST JAINTA HILLS,THADLASKEIN,2015-02-18 21:51:44.120,rice cultural practice
,AGRICULTURE,Cereals,Paddy (Dhan),Cultural Practices,RICE CULTIVATION PRACTICES,ANSWERED IN DETAILS..,MEGHALAYA,EAST JAINTA HILLS,THADLASKEIN,2015-02-19 14:59:29.287,rice cultivation practices
,AGRICULTURE,Others,Others,	Plant Protection	,asking bordeaux mixture,advised him to enquire from the block and concern department,MEGHALAYA,EAST JAINTA HILLS,THADLASKEIN,2015-02-19 15:03:41.430,bordeaux mixture
